{
  "file_type": "answer_key_file",
  "subject_id": "mimamsa",
  "version": "0.1.0",
  "answer_keys": [
    {
      "answer_key_id": "AK-MIM-0001",
      "question_id": "MIM-0001",
      "key_type": "rubric_and_reference_answer",
      "reference_answer": "Dharma is known through Vedic injunction because it concerns a normatively enjoined and often unseen result-bearing action, not an object available to ordinary perception. Inference may support interpretation but cannot independently establish Vedic duty in the same way.",
      "scoring_rubric": [
        {
          "criterion": "Connects dharma to codana or injunction",
          "points": 3
        },
        {
          "criterion": "Explains why perception is insufficient",
          "points": 3
        },
        {
          "criterion": "Explains limits of inference",
          "points": 2
        },
        {
          "criterion": "Uses Mimamsa vocabulary accurately",
          "points": 2
        }
      ],
      "acceptable_variants": [
        "May discuss Vedic sentence authority or apaurusheyatva if relevant."
      ]
    },
    {
      "answer_key_id": "AK-MIM-0002",
      "question_id": "MIM-0002",
      "key_type": "rubric_and_reference_answer",
      "reference_answer": "The opening begins an inquiry into dharma: the Veda-grounded object of ritual duty. The inquiry is not merely empirical because the relevant duty, eligibility, ritual force, and unseen result are determined by scriptural injunction and interpretation.",
      "scoring_rubric": [
        {
          "criterion": "Identifies inquiry into dharma",
          "points": 3
        },
        {
          "criterion": "Explains Vedic grounding",
          "points": 3
        },
        {
          "criterion": "Distinguishes from empirical action",
          "points": 3
        },
        {
          "criterion": "Mentions ritual or normative context",
          "points": 1
        }
      ],
      "acceptable_variants": [
        "May compare with Vedanta's brahmajijnasa if the distinction is accurate."
      ]
    },
    {
      "answer_key_id": "AK-MIM-0003",
      "question_id": "MIM-0003",
      "key_type": "rubric_and_reference_answer",
      "reference_answer": "Vidhi is injunctive language that enjoins action. Arthavada is explanatory, narrative, praise, blame, or contextual material. Mimamsa often treats arthavada as supporting an injunction by praising the enjoined act, condemning the prohibited act, or clarifying motive and context.",
      "scoring_rubric": [
        {
          "criterion": "Defines vidhi accurately",
          "points": 3
        },
        {
          "criterion": "Defines arthavada accurately",
          "points": 3
        },
        {
          "criterion": "Explains support relation to injunction",
          "points": 4
        },
        {
          "criterion": "Avoids treating arthavada as always independent doctrine",
          "points": 2
        }
      ],
      "acceptable_variants": [
        "Examples of praise, blame, story, or explanatory statement are acceptable."
      ]
    },
    {
      "answer_key_id": "AK-MIM-0004",
      "question_id": "MIM-0004",
      "key_type": "rubric_and_reference_answer",
      "reference_answer": "Apurva is an unseen potency or mediating efficacy generated by ritual action, used to explain how a correctly performed rite can yield a result not immediately visible. It is needed where direct causal continuity between rite and later fruit is not empirically available.",
      "scoring_rubric": [
        {
          "criterion": "Defines apurva as unseen mediating efficacy",
          "points": 4
        },
        {
          "criterion": "Connects ritual act to later result",
          "points": 3
        },
        {
          "criterion": "Explains why ordinary causality is insufficient",
          "points": 3
        },
        {
          "criterion": "Frames answer in Mimamsa ritual theory",
          "points": 2
        }
      ],
      "acceptable_variants": [
        "Do not require a single sectarian formulation."
      ]
    },
    {
      "answer_key_id": "AK-MIM-0005",
      "question_id": "MIM-0005",
      "key_type": "rubric_and_reference_answer",
      "reference_answer": "A strong answer mentions interpretive tools such as context, syntactic connection, proximity, repetition, direct statement, indicatory marks, primary and secondary meaning, and the distinction between injunction, mantra, name, and arthavada. It should show that apparent conflict is tested through hermeneutic reconciliation before contradiction is admitted.",
      "scoring_rubric": [
        {
          "criterion": "Identifies several Mimamsa interpretive considerations",
          "points": 5
        },
        {
          "criterion": "Explains reconciliation before contradiction",
          "points": 3
        },
        {
          "criterion": "Applies tools to ritual detail conflict",
          "points": 3
        },
        {
          "criterion": "Uses technical vocabulary carefully",
          "points": 1
        }
      ],
      "acceptable_variants": [
        "Accept discussion of shruti, linga, vakya, prakarana, sthana, and samakhya where accurately used."
      ]
    }
  ]
}

